{"$id":"urn:lima:v4:lima.run-manifest","$schema":"https://json-schema.org/draft/2020-12/schema","additionalProperties":false,"properties":{"plan":{"properties":{"artifact_id":{"pattern":"^[A-Za-z0-9][A-Za-z0-9._:-]{0,127}$","type":"string"},"content_digest":{"pattern":"^[0-9a-f]{64}$","type":"string"},"kind":{"enum":["lima.vulnerability-evidence-package","lima.workflow","lima.stage-attempt","lima.plan"],"type":"string"},"schema_version":{"pattern":"^4\\.[0-9]+$","type":"string"}},"required":["kind","artifact_id","content_digest","schema_version"],"type":"object"},"plan_revision":{"minimum":1,"type":"integer"},"resource_artifact_ids":{"items":{"pattern":"^[A-Za-z0-9][A-Za-z0-9._:-]{0,127}$","type":"string"},"maxItems":256,"type":"array"},"stage_attempts":{"items":{"properties":{"artifact_id":{"pattern":"^[A-Za-z0-9][A-Za-z0-9._:-]{0,127}$","type":"string"},"content_digest":{"pattern":"^[0-9a-f]{64}$","type":"string"},"kind":{"enum":["lima.vulnerability-evidence-package","lima.workflow","lima.stage-attempt","lima.plan"],"type":"string"},"schema_version":{"pattern":"^4\\.[0-9]+$","type":"string"}},"required":["kind","artifact_id","content_digest","schema_version"],"type":"object"},"maxItems":256,"type":"array"},"workflow":{"properties":{"artifact_id":{"pattern":"^[A-Za-z0-9][A-Za-z0-9._:-]{0,127}$","type":"string"},"content_digest":{"pattern":"^[0-9a-f]{64}$","type":"string"},"kind":{"enum":["lima.vulnerability-evidence-package","lima.workflow","lima.stage-attempt","lima.plan"],"type":"string"},"schema_version":{"pattern":"^4\\.[0-9]+$","type":"string"}},"required":["kind","artifact_id","content_digest","schema_version"],"type":"object"}},"required":["plan","plan_revision","resource_artifact_ids","stage_attempts","workflow"],"title":"lima.run-manifest","type":"object"}