{"plan":{"artifact_id":"plan-0002","content_digest":"9390344cd8018f450d115b085b577a7c723fb0abf214c552bd2cc9de6711851c","kind":"lima.plan","schema_version":"4.0"},"plan_revision":2,"resource_artifact_ids":["sandbox-run-0001","tool-bundle-0001"],"stage_attempts":[{"artifact_id":"attempt-audit-0001","content_digest":"418c461a1d82fcc9cbf6b60d1caad21e76491abe2d4f4a0a3a1a178cb15e8fb4","kind":"lima.stage-attempt","schema_version":"4.0"},{"artifact_id":"attempt-profile-0001","content_digest":"34746de4860ae5ce9ec69c43ad8c8ad596d4e79172a284bf3defc1a866edb259","kind":"lima.stage-attempt","schema_version":"4.0"}],"workflow":{"artifact_id":"wf-0001","content_digest":"3be59c6c7f1736954fbce5f1e74b4c7789ab8a1e956f4229904ea30bbe756146","kind":"lima.workflow","schema_version":"4.0"}}